#,Date,Paint,Growth,Anodes,Thru-hulls,Prop,Notes,Installed
01,05/31/2024,"Fair, Good","Heavy, Minimal",Good,Sound,Polished,"Moderate barnacles on rudder, prop, and waterline",0
02,07/03/2024,"Fair, Poor","Minimal, Moderate",Good,Sound,Polished,"Paint worn through in several areas: waterline, keel, and hull around prop and rudder. ",0
03,09/09/2024,"Fair, Poor","Heavy, Moderate","Good, Replaced",Sound,Polished,"Paint is missing along waterline at bow and rudder. Paint anti-fouling properties are failing or missing overall. Installed one heavy duty streamlined 1-1/8” shaft zinc. ",
04,11/11/2024,"Fair, Missing","Heavy, Moderate","Good, Replaced",Sound,Good,"Large blisters observed on keel. Increasing areas of missing paint. Haul out recommended ASAP. ",
05,01/22/2025,"Missing, Poor","Heavy, Moderate","Good, Missing",Sound,Good,"Will return with additional shaft anode. ",
06,03/13/2025,"Missing, Poor",Moderate,Fair,Sound,Polished,,
07,05/02/2025,"Missing, Poor",Moderate,Fair,Sound,Good,,
08,09/25/2025,"Excellent, Poor","Minimal, Moderate",Good,Sound,Good,"Most of the paint on starboard exhibits all of the properties of old paint, except in a few specific areas where you can see the roller strokes. In those spots, the paint is evidently new and effectively repelling growth, as it is for the entire port side. The difference is stark and delineated exactly along the keel edge between port and starboard. ",